{
  "schema_version": 1,
  "policy_id": "djsupport/sqlite-runtime-qualification/1",
  "selected_binding": {
    "distribution": "apsw",
    "version": "3.53.4.0"
  },
  "withdrawn_sqlite_versions": [
    "3.52.0"
  ],
  "affected_sqlite_ranges": [
    {
      "minimum": "3.7.0",
      "maximum": "3.51.2",
      "exceptions": [
        "3.44.6",
        "3.50.7"
      ]
    }
  ],
  "entries": [
    {
      "activated_at_utc": "2026-08-16T07:32:57Z",
      "artifact": {
        "build": {
          "runner_image": {
            "label": "macos-15-intel",
            "manifest_url": "https://github.com/actions/runner-images/releases/tag/macos15%2F20260727.0377.1",
            "version": "20260727.0377.1"
          },
          "source_commit": "09b6a89e13e1c49f13bfb92fdb8725d1a0f03b5a",
          "source_repository_url": "https://github.com/rogerbinns/apsw",
          "workflow_url": "https://github.com/rogerbinns/apsw/actions/workflows/build-pypi.yml"
        },
        "download_url": "https://files.pythonhosted.org/packages/6c/21/efe6ffd8680bba0cde918ad37e10c94896a7a0c0fe0ef5dbf8e97f88fd71/apsw-3.53.4.0-cp310-cp310-macosx_10_9_x86_64.whl",
        "filename": "apsw-3.53.4.0-cp310-cp310-macosx_10_9_x86_64.whl",
        "platform_tag": "macosx_10_9_x86_64",
        "publisher": {
          "identity": "github/rogerbinns/apsw/build-pypi.yml",
          "provenance_url": "https://pypi.org/integrity/apsw/3.53.4.0/apsw-3.53.4.0-cp310-cp310-macosx_10_9_x86_64.whl/provenance"
        },
        "sha256": "da86a8d03c55615ab494f474e94e06e86eb1cf5977a99d4734cd5699d4a57a65",
        "size_bytes": 3269707,
        "vendor": "PyPI"
      },
      "artifact_id": "apsw/3.53.4.0/macos-15-intel/3.10.21",
      "classification": "qualified_upstream",
      "evidence_id": "apsw/3.53.4.0/macos-15-intel/3.10.21/20260727.0377.1",
      "revoked_at_utc": null,
      "selectors": {
        "binding": {
          "distribution": "apsw",
          "distribution_version": "3.53.4.0",
          "extension_sha256": "658c76ea707f44a531ef85503b79743a81f1b5cec3d461fa56e8c4829fafcd8d",
          "wrapper_version": "3.53.4.0"
        },
        "platform": {
          "architecture": "x86_64",
          "kernel_release": "24.6.0",
          "os": "macOS",
          "product_type": "not_applicable",
          "version": "15.7.7"
        },
        "python": {
          "abi": "cpython-310-darwin",
          "gil_mode": "gil",
          "implementation": "CPython",
          "version": "3.10.21"
        },
        "sqlite": {
          "compile_options_sha256": "1533787dbee9e6450bee6503fb18a38983046d5d3d3ee377d37523c34f5f2690",
          "source_id": "2026-07-24 19:02:57 bf7c7f30031888f4e796e429ab3978879485813aaca6f641c7b33e4e09459bcc",
          "using_amalgamation": true,
          "version": "3.53.4",
          "version_number": 3053004
        }
      },
      "status": "active",
      "status_evidence_id": null,
      "supersedes_evidence_id": null
    },
    {
      "activated_at_utc": "2026-08-16T07:31:18Z",
      "artifact": {
        "build": {
          "runner_image": {
            "label": "macos-15-intel",
            "manifest_url": "https://github.com/actions/runner-images/releases/tag/macos15%2F20260727.0377.1",
            "version": "20260727.0377.1"
          },
          "source_commit": "09b6a89e13e1c49f13bfb92fdb8725d1a0f03b5a",
          "source_repository_url": "https://github.com/rogerbinns/apsw",
          "workflow_url": "https://github.com/rogerbinns/apsw/actions/workflows/build-pypi.yml"
        },
        "download_url": "https://files.pythonhosted.org/packages/6a/ff/2104f2185dc6ef7b938ef304391a69ed84f70e3d084b072e0cc6e30b1982/apsw-3.53.4.0-cp311-cp311-macosx_10_9_x86_64.whl",
        "filename": "apsw-3.53.4.0-cp311-cp311-macosx_10_9_x86_64.whl",
        "platform_tag": "macosx_10_9_x86_64",
        "publisher": {
          "identity": "github/rogerbinns/apsw/build-pypi.yml",
          "provenance_url": "https://pypi.org/integrity/apsw/3.53.4.0/apsw-3.53.4.0-cp311-cp311-macosx_10_9_x86_64.whl/provenance"
        },
        "sha256": "94fab7525b77af4230a4e406c6c8dcc0dcf25eac91a1975c75706e4806d28915",
        "size_bytes": 3276362,
        "vendor": "PyPI"
      },
      "artifact_id": "apsw/3.53.4.0/macos-15-intel/3.11.9",
      "classification": "qualified_upstream",
      "evidence_id": "apsw/3.53.4.0/macos-15-intel/3.11.9/20260727.0377.1",
      "revoked_at_utc": null,
      "selectors": {
        "binding": {
          "distribution": "apsw",
          "distribution_version": "3.53.4.0",
          "extension_sha256": "d60021a5d10ea15d96d8c9260cba4c0052c16b98fe978f263e2879579c7dc77a",
          "wrapper_version": "3.53.4.0"
        },
        "platform": {
          "architecture": "x86_64",
          "kernel_release": "24.6.0",
          "os": "macOS",
          "product_type": "not_applicable",
          "version": "15.7.7"
        },
        "python": {
          "abi": "cpython-311-darwin",
          "gil_mode": "gil",
          "implementation": "CPython",
          "version": "3.11.9"
        },
        "sqlite": {
          "compile_options_sha256": "1533787dbee9e6450bee6503fb18a38983046d5d3d3ee377d37523c34f5f2690",
          "source_id": "2026-07-24 19:02:57 bf7c7f30031888f4e796e429ab3978879485813aaca6f641c7b33e4e09459bcc",
          "using_amalgamation": true,
          "version": "3.53.4",
          "version_number": 3053004
        }
      },
      "status": "active",
      "status_evidence_id": null,
      "supersedes_evidence_id": null
    },
    {
      "activated_at_utc": "2026-08-16T07:33:18Z",
      "artifact": {
        "build": {
          "runner_image": {
            "label": "macos-15-intel",
            "manifest_url": "https://github.com/actions/runner-images/releases/tag/macos15%2F20260727.0377.1",
            "version": "20260727.0377.1"
          },
          "source_commit": "09b6a89e13e1c49f13bfb92fdb8725d1a0f03b5a",
          "source_repository_url": "https://github.com/rogerbinns/apsw",
          "workflow_url": "https://github.com/rogerbinns/apsw/actions/workflows/build-pypi.yml"
        },
        "download_url": "https://files.pythonhosted.org/packages/11/28/73ec4710ba5e082d798fec2ceecf23bd982a02dbb2c4d587e8bac461e0cd/apsw-3.53.4.0-cp312-cp312-macosx_10_13_x86_64.whl",
        "filename": "apsw-3.53.4.0-cp312-cp312-macosx_10_13_x86_64.whl",
        "platform_tag": "macosx_10_13_x86_64",
        "publisher": {
          "identity": "github/rogerbinns/apsw/build-pypi.yml",
          "provenance_url": "https://pypi.org/integrity/apsw/3.53.4.0/apsw-3.53.4.0-cp312-cp312-macosx_10_13_x86_64.whl/provenance"
        },
        "sha256": "8cfa9ad1dd459d453bc7bc0b2beb2aa27f326822f0301ce1a903be1e0ad004b2",
        "size_bytes": 3274865,
        "vendor": "PyPI"
      },
      "artifact_id": "apsw/3.53.4.0/macos-15-intel/3.12.10",
      "classification": "qualified_upstream",
      "evidence_id": "apsw/3.53.4.0/macos-15-intel/3.12.10/20260727.0377.1",
      "revoked_at_utc": null,
      "selectors": {
        "binding": {
          "distribution": "apsw",
          "distribution_version": "3.53.4.0",
          "extension_sha256": "ed39e90d72de5e394b1d2ff694075b996f1c473e2e6fba3cbbdbd8583adf03d8",
          "wrapper_version": "3.53.4.0"
        },
        "platform": {
          "architecture": "x86_64",
          "kernel_release": "24.6.0",
          "os": "macOS",
          "product_type": "not_applicable",
          "version": "15.7.7"
        },
        "python": {
          "abi": "cpython-312-darwin",
          "gil_mode": "gil",
          "implementation": "CPython",
          "version": "3.12.10"
        },
        "sqlite": {
          "compile_options_sha256": "1533787dbee9e6450bee6503fb18a38983046d5d3d3ee377d37523c34f5f2690",
          "source_id": "2026-07-24 19:02:57 bf7c7f30031888f4e796e429ab3978879485813aaca6f641c7b33e4e09459bcc",
          "using_amalgamation": true,
          "version": "3.53.4",
          "version_number": 3053004
        }
      },
      "status": "active",
      "status_evidence_id": null,
      "supersedes_evidence_id": null
    },
    {
      "activated_at_utc": "2026-08-16T07:31:39Z",
      "artifact": {
        "build": {
          "runner_image": {
            "label": "macos-15-intel",
            "manifest_url": "https://github.com/actions/runner-images/releases/tag/macos15%2F20260727.0377.1",
            "version": "20260727.0377.1"
          },
          "source_commit": "09b6a89e13e1c49f13bfb92fdb8725d1a0f03b5a",
          "source_repository_url": "https://github.com/rogerbinns/apsw",
          "workflow_url": "https://github.com/rogerbinns/apsw/actions/workflows/build-pypi.yml"
        },
        "download_url": "https://files.pythonhosted.org/packages/8d/e4/a169c63cc6448598999acee33c112c2015e41b5a27374d16feed43e74ed1/apsw-3.53.4.0-cp313-cp313-macosx_10_13_x86_64.whl",
        "filename": "apsw-3.53.4.0-cp313-cp313-macosx_10_13_x86_64.whl",
        "platform_tag": "macosx_10_13_x86_64",
        "publisher": {
          "identity": "github/rogerbinns/apsw/build-pypi.yml",
          "provenance_url": "https://pypi.org/integrity/apsw/3.53.4.0/apsw-3.53.4.0-cp313-cp313-macosx_10_13_x86_64.whl/provenance"
        },
        "sha256": "fbb3cfe03751db6a2f29e938017e11851c93fddca1ac4f78287faceba4d24059",
        "size_bytes": 3273128,
        "vendor": "PyPI"
      },
      "artifact_id": "apsw/3.53.4.0/macos-15-intel/3.13.15",
      "classification": "qualified_upstream",
      "evidence_id": "apsw/3.53.4.0/macos-15-intel/3.13.15/20260727.0377.1",
      "revoked_at_utc": null,
      "selectors": {
        "binding": {
          "distribution": "apsw",
          "distribution_version": "3.53.4.0",
          "extension_sha256": "ade27b967676da3a5159b59511cf3ad7eb435f506c2dc2a86fd78a7d065400ab",
          "wrapper_version": "3.53.4.0"
        },
        "platform": {
          "architecture": "x86_64",
          "kernel_release": "24.6.0",